<?xml version="1.0" encoding="UTF-8"?>
<!--
 Licensed to the Apache Software Foundation (ASF) under one
 or more contributor license agreements. See the NOTICE file
 distributed with this work for additional information
 regarding copyright ownership. The ASF licenses this file
 to you under the Apache License, Version 2.0 (the
 "License"); you may not use this file except in compliance
 with the License. You may obtain a copy of the License at

 http://www.apache.org/licenses/LICENSE-2.0

 Unless required by applicable law or agreed to in writing,
 software distributed under the License is distributed on an
 "AS IS" BASIS, WITHOUT WARRANTIES OR CONDITIONS OF ANY
 KIND, either express or implied. See the License for the
 specific language governing permissions and limitations
 under the License. 
 -->
 <avro:realRoot day="---12" month="--08" xmlns:avro="urn:avro:complex_schema" xmlns:test="http://avro.apache.org/AvroTest" xmlns:xsi="http://www.w3.org/2001/XMLSchema-instance" xsi:schemaLocation="urn:avro:complex_schema complex_schema.xsd http://avro.apache.org/AvroTest test_schema.xsd"  year="2014">
  <avro:backtrack>
    <avro:qName xmlns:iso4217="http://www.xbrl.org/2003/iso4217">iso4217:USD</avro:qName>
    <avro:avroEnum>avro</avro:avroEnum>
    <avro:xmlEnum>thrift</avro:xmlEnum>
    <avro:xmlEnum>rest.li</avro:xmlEnum>
    <avro:unsignedLongList>1 2 345 67890 1234567890 12345678901234567890</avro:unsignedLongList>
    <avro:listOfUnion>true false hello goodbye 1234567890 -2147483648 2147483649</avro:listOfUnion>
  </avro:backtrack>
  <avro:allTheThings id="idvalue0">
    <avro:secondMap id="idvalue2" value="Second Map Value"/>
    <avro:firstMap id="idvalue1">
      <avro:value />
      <avro:value xsi:nil="true" />
    </avro:firstMap>
  </avro:allTheThings>
  <avro:prohibit>
    <avro:fixed/>
  </avro:prohibit>
  <avro:anyAndFriends>
    This is a mixed element
  	<test:list>
  		<test:record>
  			<test:primitive>float</test:primitive>
  		</test:record>
  	</test:list>
  	interspersed with wildcard elements.
  	<test:primitive>null</test:primitive>
  	Since the wildcard elements are filtered
  	<test:primitive>boolean</test:primitive>
  	away, the final Avro document should
  	<test:primitive>int</test:primitive>
  	only contain this text.
  	<avro:xmlEnum>json</avro:xmlEnum>
  	<avro:avroEnum>json</avro:avroEnum>
  	(If I did it right.)
  </avro:anyAndFriends>
  <avro:simpleExtension default="named">true</avro:simpleExtension>
  <avro:simpleRestriction>false</avro:simpleRestriction>
  <avro:complexExtension>
  	<avro:fixed />
  	<avro:unsignedLongList>1 2 4 5 6</avro:unsignedLongList>
  </avro:complexExtension>
  <avro:mixedType>
  	Hello, my name is
  	<avro:listOfUnion>Mike and I</avro:listOfUnion>
  	welcome you to this mixed element with
  	<avro:unsignedLongList>2</avro:unsignedLongList>
  	sub-elements.
  </avro:mixedType>
</avro:realRoot>
